{
  "id": "KB-0001",
  "title": "实验室安全总则-通风柜使用",
  "category": "通用",
  "subcategory": "设备使用",
  "lab_type": "化学",
  "risk_level": 2,
  "hazard_types": ["通风", "挥发性"],
  "scenario": "在通风柜内进行挥发性溶剂操作",
  "question": "通风柜什么时候必须开启？",
  "answer": "处理挥发性、刺激性或有毒溶剂时必须开启通风柜，操作时保持前窗在规定高度范围，并确认风速正常。",
  "steps": [
    "检查风速与报警状态",
    "前窗降至安全刻度",
    "在柜内操作",
    "结束后延迟关闭"
  ],
  "ppe": ["护目镜", "实验服", "手套"],
  "forbidden": ["不要将头部伸入柜内", "不要在柜内存放大量化学品"],
  "disposal": "按MSDS分类; 溶剂废液入有机废液桶",
  "first_aid": "如吸入不适，立即移至通风处并就医",
  "emergency": "如发生大量泄漏，启动实验室应急程序",
  "legal_notes": "遵守校内实验室安全管理制度",
  "references": ["SOP-通风柜使用规范"],
  "source": {
    "type": "SOP",
    "title": "通风柜使用规范",
    "org": "实验室管理处",
    "version": "2024版",
    "date": "2024-06-01",
    "url": ""
  },
  "last_updated": "2026-03-10",
  "reviewer": "",
  "status": "draft",
  "tags": ["通风柜", "溶剂"],
  "language": "zh-CN"
}
